{"admitted_artifact_path":"git/admission-status.txt","admitted_artifact_sha256":"669f1cb0b766301ead1aee9e78fe306f6da40b1d30b0b846d75d2ccb4e0a84c2","base_prompt_path":"prompts/cursor-initial.txt","base_prompt_sha256":"cb8104296f15453bbc5287bf7d6037e7bcb68294cd0cffa0621163a7d2ec0cfb","chat_id":"019abc00-1111-2222-3333-444444444444","config_sha256":"7a12c4681c47704b30dc9f67260de2ea96bac522d62eb751e809208186948b51","dispatch_id":"fx-c3a3a7f114430531b6a3cf13eea35035","effective_prompt_path":"prompts/cursor-initial-recovery/effective.txt","effective_prompt_sha256":"e59259af1ed2d7312994333b03887ef7e78446fcc0dfaf8542501b285ba52198","failed_attempt_id":"att-00000000000000000000000000000005","iteration":1,"parent_record_sha256":null,"parent_recovery_key":null,"parent_source_run_id":null,"plan_sha256":"0ba8876fcb7d7e9672095388801988261ba0d998d0233d9c0e71947ba8834bd0","reviewer_created":false,"reviews_completed":0,"schema_version":1,"source_run_id":"fixture-project-20261005T222627Z-3fb63d","submitted_prompt_sha256":"cb8104296f15453bbc5287bf7d6037e7bcb68294cd0cffa0621163a7d2ec0cfb","successor_run_id":"fixture-project-20261005T222630Z-4c21d2","turn_kind":"initial"}